Task ID,Task Name,Description,Duration,Start Week,End Week,Dependencies,Assigned To,Hours,% Complete,Status,Notes,Risk Level,Mitigation,Key Dependencies,Due Date
FT-04.8.2,Member Management,Build member list and management tools,1 day,Week 8,Week 8,FT-04.8.1,Frontend + Backend Dev,8,0%,Not Started,View all members assign roles ban/remove review requests,Medium,Bulk actions; search/filter,None,Week 8 End

FT-04.9,Tribe Discovery,Build browse and search interface for tribes,3 days,Week 8,Week 8,FT-04.8,Frontend + Backend Dev,24,0%,Not Started,Client dependent; build from scratch,High,Category filters search recommendations trending,Search infrastructure,Week 8 End
FT-04.9.1,Browse Interface,Create explore/discover page for tribes,1 day,Week 8,Week 8,FT-04.9,Frontend Dev,8,0%,Not Started,Category filters sort options tribe cards,Medium,Empty state messaging,UI design,Week 8 Day 8
FT-04.9.2,Tribe Search,Implement search functionality,1 day,Week 8,Week 8,FT-04.9.1,Backend + Frontend Dev,8,0%,Not Started,Search by name and description; rank by relevance,Medium,Exclude hidden tribes; respect blocks,Search service,Week 8 Day 9
FT-04.9.3,Recommendations Engine,Build tribe recommendation system,1 day,Week 8,Week 8,FT-04.9.2,Backend Dev,8,0%,Not Started,Based on user interests activity and joins,High,Algorithm for personalization,User data,Week 8 End

FT-04.10,Tribe Notifications,Implement per-tribe notification preferences,2 days,Week 8,Week 8,FT-04.9,Backend + Frontend Dev,16,0%,Not Started,Tentative 2 days client dependent,Medium,All activity mentions only or none; digest option,Notification framework,Week 8 End
FT-04.10.1,Notification Preferences UI,Build per-tribe notification settings,1 day,Week 8,Week 8,FT-04.10,Frontend Dev,8,0%,Not Started,Toggle for each tribe; global defaults,Low,Accessible from tribe page and settings,None,Week 8 Day 10
FT-04.10.2,Notification Logic,Implement notification filtering per tribe,1 day,Week 8,Week 8,FT-04.10.1,Backend Dev,8,0%,Not Started,Respect per-tribe preferences; aggregate high activity,Medium,Daily/weekly digest option,Notification system,Week 8 End

FT-04.11,Tribe Analytics Dashboard,Build analytics for tribe admins,1 week,Week 8,Week 8,FT-04.10,Backend + Frontend Dev,40,0%,Not Started,Tentative 1 week client dependent; build from scratch,High,Member growth post activity engagement top contributors,Analytics infrastructure,Week 8 End
FT-04.11.1,Analytics Data Collection,Implement data aggregation for tribe metrics,2 days,Week 8,Week 8,FT-04.11,Backend Dev,16,0%,Not Started,Track members posts engagement over time,High,Efficient queries; scheduled jobs,Database design,Week 8 Day 12
FT-04.11.2,Analytics Dashboard UI,Create visual dashboard with charts,2 days,Week 8,Week 8,FT-04.11.1,Frontend Dev,16,0%,Not Started,Charts for trends; date range selector; export CSV,Medium,Choose chart library (Chart.js/Recharts),None,Week 8 Day 14
FT-04.11.3,Key Metrics Display,Show critical tribe health metrics,1 day,Week 8,Week 8,FT-04.11.2,Frontend + Backend Dev,8,0%,Not Started,Total members new members churn posts engagement active members,Low,Real-time vs cached data indicator,None,Week 8 End

FT-05,Chat & Messaging System,Build complete direct messaging functionality,1 week,Week 9,Week 9,FT-04,Backend + Frontend Dev,40,0%,Not Started,Real-time WebSocket-based messaging with file sharing,High,WebSocket reliability; message queuing; offline support,Chat design finalized,Week 9 End

FT-05.1,Messaging Access Control,Implement DM permission settings,1 day,Week 9,Week 9,FT-05,Backend Dev,8,0%,Not Started,Everyone Followers or No one; message requests optional,Low,Check permissions before sending,Privacy system ready,Week 9 Day 1

FT-05.2,Conversation List,Build conversation list interface,1 day,Week 9,Week 9,FT-05.1,Frontend + Backend Dev,8,0%,Not Started,Show all conversations with preview and unread badges,Medium,Real-time updates; search conversations,WebSocket setup,Week 9 Day 2

FT-05.3,Conversation Thread,Create chat-style message thread UI,1 day,Week 9,Week 9,FT-05.2,Frontend + Backend Dev,8,0%,Not Started,Chronological messages; own messages right-aligned,Medium,Virtualized list; load older on scroll up,Chat UI components,Week 9 Day 3

FT-05.4,Sending Messages,Implement message sending with optimistic UI,0.5 days,Week 9,Week 9,FT-05.3,Frontend + Backend Dev,4,0%,Not Started,2000 char max; 60 messages per minute limit; emoji picker,Low,Retry on failure; queue when offline,None,Week 9 Day 4

FT-05.5,Message Actions,Add edit delete and copy message actions,0.5 days,Week 9,Week 9,FT-05.4,Frontend + Backend Dev,4,0%,Not Started,15-min edit window; 24-hour delete window; edited indicator,Low,Context menu; confirmations,None,Week 9 Day 4

FT-05.6,Typing Indicators,Implement real-time typing indicators,0.5 days,Week 9,Week 9,FT-05.5,Frontend + Backend Dev,4,0%,Not Started,Show [User] is typing with animation; hide after 5 sec,Low,Debounce to 2-second intervals; WebSocket events,WebSocket ready,Week 9 Day 5

FT-05.7,File Sharing,Add file attachment and download in messages,1 day,Week 9,Week 9,FT-05.6,Backend + Frontend Dev,8,0%,Not Started,20MB max; images docs videos; up to 5 files per message,Medium,Virus scan optional; progress indicators,File storage service,Week 9 Day 6

FT-05.8,Chat Notifications,Implement message notifications,0.5 days,Week 9,Week 9,FT-05.7,Backend Dev,4,0%,Not Started,In-app and push; show sender and preview; per-conversation mute,Low,Don't notify if in active conversation; aggregate,Notification system,Week 9 Day 6

FT-05.9,Online Status,Add online/offline status indicators,0.5 days,Week 9,Week 9,FT-05.8,Backend + Frontend Dev,4,0%,Not Started,Green dot for online; last active timestamp; hide status option,Low,Update within 1 minute; away after 5 min idle,Presence tracking,Week 9 Day 7

FT-05.10,Blocking in Messages,Implement block functionality for DMs,0.5 days,Week 9,Week 9,FT-05.9,Backend Dev,4,0%,Not Started,Hide conversation from both parties; prevent new messages,Low,Unblock restores access,Block system ready,Week 9 End

FT-06,Notifications System,Build comprehensive notification infrastructure,1 week,Week 10,Week 10,FT-05,Backend + Frontend Dev,40,0%,Not Started,In-app push and email notifications with preferences,High,Reliable delivery; real-time updates; aggregation,Notification design,Week 10 End

FT-06.1,Notification Types & Icons,Define all notification types with icons,2 days,Week 10,Week 10,FT-06,Backend + Frontend Dev,16,0%,Not Started,Like comment mention follow tribe DM repost types,Low,Custom icons for FanTribe features,Icon assets,Week 10 Day 2

FT-06.2,Notification Center,Build notification dropdown and history page,1 day,Week 10,Week 10,FT-06.1,Frontend + Backend Dev,8,0%,Not Started,Dropdown with 20 recent; mark all read; link to content,Medium,Real-time WebSocket updates; group similar,WebSocket ready,Week 10 Day 3

FT-06.3,Unread Badge,Implement unread notification count badge,0.5 days,Week 10,Week 10,FT-06.2,Frontend Dev,4,0%,Not Started,Red badge with count; 99+ for large counts,Low,Clear on view; real-time updates,None,Week 10 Day 4

FT-06.4,In-App Toast Notifications,Create toast notifications for new activity,0.5 days,Week 10,Week 10,FT-06.3,Frontend Dev,4,0%,Not Started,Auto-dismiss after 5 seconds; stack max 3; click to navigate,Low,Don't show toast for current page content,None,Week 10 Day 4

FT-06.5,Push Notifications,Implement web and mobile push notifications,1 day,Week 10,Week 10,FT-06.4,Backend + Frontend Dev,8,0%,Not Started,Opt-in prompt; deliver to closed app; action buttons,High,Configure FCM/APNs; deep linking,Push service setup,Week 10 Day 5

FT-06.6,Notification Preferences,Build comprehensive preference controls,1 day,Week 10,Week 10,FT-06.5,Frontend + Backend Dev,8,0%,Not Started,Per-type toggles; channel options; quiet hours; per-tribe,Medium,Save preferences; apply immediately,None,Week 10 Day 6

FT-06.7,Notification Retention & History,Implement storage and cleanup,1 day,Week 10,Week 10,FT-06.6,Backend Dev,8,0%,Not Started,90-day retention; 1000 max per user; auto-cleanup; filter by type,Low,Efficient queries; batch cleanup jobs,Database indexed,Week 10 End

FT-07,Admin & Moderation System,Build complete admin panel and moderation tools,2 weeks,Week 11,Week 12,FT-06,Backend + Frontend Dev,80,0%,Not Started,Comprehensive platform management and content moderation,High,Security audit; role-based access; activity logging,Admin requirements,Week 12 End

FT-07.1,Admin Access & Security,Implement secure admin authentication,1 day,Week 11,Week 11,FT-07,Backend Dev,8,0%,Not Started,2FA required; session timeout; IP whitelist optional; role hierarchy,High,Recovery process; session management,2FA library,Week 11 Day 1

FT-07.2,Dashboard Overview,Build admin dashboard with key metrics,2 days,Week 11,Week 11,FT-07.1,Frontend + Backend Dev,16,0%,Not Started,User growth DAU/WAU/MAU content metrics moderation queue system health,Medium,Customizable widgets; real-time data; FanTribe-specific,Analytics data,Week 11 Day 3

FT-07.3,Content Reporting System,Implement user reporting functionality,1 day,Week 11,Week 11,FT-07.2,Frontend + Backend Dev,8,0%,Not Started,Report button on all content; reason selection; 10 reports/day limit,Medium,Prevent abuse; track reporters; consolidate duplicates,None,Week 11 Day 4

FT-07.4,Report Review Queue,Build moderation queue for admins,1 day,Week 11,Week 11,FT-07.3,Frontend + Backend Dev,8,0%,Not Started,List pending reports; content preview; action buttons; bulk actions,High,Lock during review; SLA warnings,Queue design,Week 11 Day 5

FT-07.5,User Management,Create user management interface for admins,1 day,Week 11,Week 11,FT-07.4,Frontend + Backend Dev,8,0%,Not Started,Search users; view profiles; suspend/ban; edit fields; delete account,High,Suspension durations; appeal process,None,Week 11 Day 6

FT-07.6,Announcements System,Build platform-wide announcement tool,0.5 days,Week 11,Week 11,FT-07.5,Frontend + Backend Dev,4,0%,Not Started,Banner at top; rich text; schedule start/end; priority levels; dismiss,Low,Target specific groups; remember dismissal,None,Week 11 Day 6

FT-07.7,Audit Logs,Implement comprehensive activity logging,0.5 days,Week 11,Week 11,FT-07.6,Backend Dev,4,0%,Not Started,Log all admin actions; filter by type/user/date; export CSV; tamper-proof,High,1-year retention; mask sensitive data,Logging infrastructure,Week 11 End

FT-07.8,Platform Analytics,Build enhanced analytics dashboard,1 week,Week 12,Week 12,FT-07.7,Backend + Frontend Dev,40,0%,Not Started,User content tribe engagement traffic metrics; date ranges; export,High,Data aggregation; caching; visualization library,Analytics design,Week 12 End
FT-07.8.1,Data Collection & Aggregation,Build analytics data pipeline,2 days,Week 12,Week 12,FT-07.8,Backend Dev,16,0%,Not Started,Scheduled jobs for aggregation; efficient queries; caching,High,Real-time vs batch; data warehouse,Database design,Week 12 Day 2
FT-07.8.2,Analytics Dashboard UI,Create visual analytics interface,2 days,Week 12,Week 12,FT-07.8.1,Frontend Dev,16,0%,Not Started,Interactive charts; comparison periods; multiple metrics,Medium,Chart library integration; responsive,Chart.js/D3,Week 12 Day 4
FT-07.8.3,Report Generation,Add export and scheduled report functionality,1 day,Week 12,Week 12,FT-07.8.2,Backend Dev,8,0%,Not Started,CSV/PDF export; scheduled email reports; custom date ranges,Low,Background jobs for large exports,Report templates,Week 12 Day 5

FT-08,Testing Quality Assurance & Launch Prep,Comprehensive testing and optimization before launch,2 weeks,Week 13,Week 14,FT-07,QA + DevOps + Full Team,80,0%,Not Started,End-to-end testing performance optimization security audit documentation,Critical,Thorough testing; staged rollout; rollback plan,Test environment ready,Week 14 End

FT-08.1,Unit & Integration Testing,Write and execute comprehensive test suite,3 days,Week 13,Week 13,FT-08,Backend + Frontend Dev,24,0%,Not Started,Unit tests for all components; integration tests for APIs; >80% coverage,High,Automated test runs; CI/CD pipeline,Testing framework,Week 13 Day 3

FT-08.2,End-to-End Testing,Conduct user flow testing across all features,2 days,Week 13,Week 13,FT-08.1,QA Team,16,0%,Not Started,Test all user journeys; cross-browser; mobile responsive; edge cases,High,Use Playwright/Cypress; document bugs,Test scenarios defined,Week 13 End

FT-08.3,Performance Optimization,Optimize application performance,2 days,Week 13,Week 13,FT-08.2,Backend + Frontend Dev,16,0%,Not Started,Page load times; database queries; image optimization; caching,High,Target metrics: <3s load <2s API response,Performance tools,Week 13 End

FT-08.4,Security Audit,Conduct security testing and fixes,2 days,Week 14,Week 14,FT-08.3,Security Team + Backend Dev,16,0%,Not Started,Penetration testing; XSS/CSRF prevention; rate limiting; encryption audit,Critical,Fix all critical and high-severity issues,Security checklist,Week 14 Day 2

FT-08.5,Accessibility Testing,Ensure WCAG compliance,1 day,Week 14,Week 14,FT-08.4,Frontend Dev + QA,8,0%,Not Started,Screen reader testing; keyboard navigation; color contrast; ARIA labels,Medium,Target WCAG 2.1 Level AA,Accessibility tools,Week 14 Day 3

FT-08.6,Documentation,Create user and technical documentation,2 days,Week 14,Week 14,FT-08.5,Technical Writer + Team,16,0%,Not Started,User guide; admin manual; API docs; deployment guide; architecture docs,Medium,Clear comprehensive searchable,Documentation plan,Week 14 End

FT-08.7,Beta Testing,Conduct closed beta with selected users,1 week,Week 14,Week 14,FT-08.6,Community Manager + QA,8,0%,Not Started,50-100 beta users; feedback collection; bug reporting; feature validation,High,Diverse user group; iterative fixes,Beta user list,Week 14 End

FT-08.8,Launch Preparation,Prepare infrastructure and marketing for launch,1 week,Week 14,Week 14,FT-08.7,DevOps + Marketing + Full Team,8,0%,Not Started,Production deployment; monitoring setup; marketing campaign; support readiness,Critical,Staged rollout plan; rollback procedures; 24/7 support,Launch checklist,Week 14 End

FT-09,Post-Launch Support & Iteration,Ongoing monitoring optimization and feature iteration,Ongoing,Week 15,Ongoing,FT-08,Full Team,Ongoing,0%,Not Started,Monitor performance; gather feedback; fix bugs; iterate on features,High,Incident response plan; feedback loops; regular updates,Production monitoring,Ongoing